{
  "$schema": "http://json-schema.org/draft-07/schema#",
  "definitions": {
    "ArtifactKindV1": {
      "description": "AiDENs-local display discriminator; not a canonical artifact family schema.",
      "type": "string"
    },
    "RegressionDebtItemV1": {
      "properties": {
        "debt_id": {
          "type": "string"
        },
        "description": {
          "type": "string"
        },
        "detection": {
          "type": "string"
        },
        "guardrail_tests": {
          "items": {
            "type": "string"
          },
          "type": "array"
        },
        "owner": {
          "type": "string"
        },
        "reason_codes": {
          "items": {
            "type": "string"
          },
          "type": "array"
        },
        "status": {
          "$ref": "#/definitions/RegressionDebtStatusV1"
        },
        "surface_id": {
          "type": "string"
        }
      },
      "required": [
        "debt_id",
        "description",
        "detection",
        "guardrail_tests",
        "owner",
        "status",
        "surface_id"
      ],
      "type": "object"
    },
    "RegressionDebtStatusV1": {
      "enum": [
        "guarded",
        "accepted",
        "deferred",
        "blocked"
      ],
      "type": "string"
    }
  },
  "properties": {
    "blocking_debt_ids": {
      "items": {
        "type": "string"
      },
      "type": "array"
    },
    "generated_at": {
      "format": "date-time",
      "type": "string"
    },
    "items": {
      "items": {
        "$ref": "#/definitions/RegressionDebtItemV1"
      },
      "type": "array"
    },
    "kind": {
      "$ref": "#/definitions/ArtifactKindV1"
    },
    "ledger_id": {
      "type": "string"
    },
    "reason_codes": {
      "items": {
        "type": "string"
      },
      "type": "array"
    }
  },
  "required": [
    "generated_at",
    "items",
    "kind",
    "ledger_id"
  ],
  "title": "RegressionDebtLedgerV1",
  "type": "object"
}
